{
  "spec_version": "v1.5.5",
  "receipt_type": "tower_run_plus",
  "created_at": "2026-01-16T21:45:08+00:00",
  "card_id": "ADDON-SMOKE",
  "run_id": "20260116_214505_a1ee1268",
  "run_dir": "/c/Users/user/tower/artifacts/2026-01-16/ADDON-SMOKE/run_20260116_214505_a1ee1268",
  "tower_run_exit_code": 0,
  "addons_enabled": {
    "mlflow": false,
    "tracing": false,
    "prefect": false
  },
  "addon_results": {
    "mlflow": {
      "status": "DISABLED",
      "mlflow_run_id": null,
      "receipt_path": null
    },
    "tracing": {
      "status": "DISABLED",
      "trace_url": null
    }
  },
  "command": "echo ADDON_SMOKE_OK",
  "session": "apps_dev1",
  "model": "noop"
}
