{
  "spec_version": "v1.5.5",
  "receipt_type": "tower_run_plus",
  "created_at": "2026-01-16T22:29:09+00:00",
  "card_id": "TEST-002",
  "run_id": "20260116_222907_1dbdd9b1",
  "run_dir": "/c/Users/user/tower/artifacts/2026-01-16/TEST-002/run_20260116_222907_1dbdd9b1",
  "tower_run_exit_code": 0,
  "addons_enabled": {
    "mlflow": false,
    "tracing": false,
    "prefect": false
  },
  "addon_results": {
    "mlflow": {
      "status": "DISABLED",
      "mlflow_run_id": null,
      "receipt_path": null
    },
    "tracing": {
      "status": "DISABLED",
      "trace_url": null
    }
  },
  "command": "echo test",
  "session": "test",
  "model": null
}
